{
  "ok": true,
  "plan_id": "fixture-valid-next-three",
  "problems": [],
  "steps": [
    {
      "path": ".prompts/PROMPT_33.txt",
      "problems": [],
      "prompt_id": "PROMPT_33",
      "status": "pass",
      "validation_commands": [
        "python3 -m unittest tests/test_ahl.py"
      ]
    },
    {
      "path": ".prompts/PROMPT_34.txt",
      "problems": [],
      "prompt_id": "PROMPT_34",
      "status": "pass",
      "validation_commands": [
        "python3 -m unittest tests/test_ahl.py"
      ]
    },
    {
      "path": ".prompts/PROMPT_35.txt",
      "problems": [],
      "prompt_id": "PROMPT_35",
      "status": "pass",
      "validation_commands": [
        "python3 -m unittest tests/test_ahl.py"
      ]
    }
  ]
}
